{
  "schemaVersion": 2,
  "name": "Chainabit Plugin Marketplace",
  "version": "2.0.0",
  "categories": [
    "ai",
    "cloud",
    "code",
    "data",
    "databases",
    "devops",
    "foundations",
    "infrastructure",
    "personas",
    "productivity",
    "providers",
    "security",
    "testing",
    "tooling"
  ],
  "plugins": [
    {
      "id": "provider-acmegate",
      "source": "https://github.com/chainabit/plugins.git#providers/provider-acmegate",
      "version": "1.2.0",
      "revision": "ca298380a7971fc10c2b3e907e7802fdf3680262",
      "integrity": {
        "algorithm": "sha256",
        "packageSha256": "d5a652e6ee98ace92b42d12786f4efbcbfcf77a4d7dc03649af6a145d3cd7b2c"
      }
    },
    {
      "id": "persona-reviewer",
      "source": "https://github.com/chainabit/plugins.git#personas/persona-reviewer",
      "version": "0.4.1",
      "revision": "ca298380a7971fc10c2b3e907e7802fdf3680262",
      "integrity": {
        "algorithm": "sha256",
        "packageSha256": "6bc6eebd9a67da1143ee196d116c4b4638f1603c24bf3a74ff24c5fc8e3ab48a"
      }
    },
    {
      "id": "skill-archive",
      "source": "https://github.com/chainabit/plugins.git#artifacts/skill-archive",
      "version": "1.1.1",
      "revision": "ca298380a7971fc10c2b3e907e7802fdf3680262",
      "integrity": {
        "algorithm": "sha256",
        "packageSha256": "c52e7c6ffe39f566e2fe6a4edb8cdb2e5e84f32696bd7d086fad03a902da671d"
      }
    },
    {
      "id": "skill-pdf",
      "source": "https://github.com/chainabit/plugins.git#artifacts/skill-pdf",
      "version": "5.5.5",
      "revision": "ca298380a7971fc10c2b3e907e7802fdf3680262",
      "integrity": {
        "algorithm": "sha256",
        "packageSha256": "088e52bcdd1308952564561799da15482bf7508a4200c570ab7891c31b54f1ee"
      }
    },
    {
      "id": "skill-xlsx",
      "source": "https://github.com/chainabit/plugins.git#artifacts/skill-xlsx",
      "version": "1.2.2",
      "revision": "ca298380a7971fc10c2b3e907e7802fdf3680262",
      "integrity": {
        "algorithm": "sha256",
        "packageSha256": "3e22b35d60a968d7d0d39f7ff60d9a8a3c09098a462601be26546fe4921b921d"
      }
    },
    {
      "id": "skill-pptx",
      "source": "https://github.com/chainabit/plugins.git#artifacts/skill-pptx",
      "version": "1.4.8",
      "revision": "ca298380a7971fc10c2b3e907e7802fdf3680262",
      "integrity": {
        "algorithm": "sha256",
        "packageSha256": "d18079a77e56a9783bee80a350e159c3d60fbcbc748b0b7d86c407de8a8220db"
      }
    },
    {
      "id": "skill-website",
      "source": "https://github.com/chainabit/plugins.git#artifacts/skill-website",
      "version": "1.0.0",
      "revision": "ca298380a7971fc10c2b3e907e7802fdf3680262",
      "integrity": {
        "algorithm": "sha256",
        "packageSha256": "7eb562a2bc8ea83642e2648ed95af7054a09affd2be4a2c737e8faaa9769bcc9"
      }
    },
    {
      "id": "skill-docx",
      "source": "https://github.com/chainabit/plugins.git#artifacts/skill-docx",
      "version": "1.2.2",
      "revision": "ca298380a7971fc10c2b3e907e7802fdf3680262",
      "integrity": {
        "algorithm": "sha256",
        "packageSha256": "f05edbf7ecd30a52d2e63918460919ccb1b021ebd4c0bb0e32aeada412c4de96"
      }
    },
    {
      "id": "provider-solongate",
      "source": "https://github.com/chainabit/plugins.git#providers/provider-solongate",
      "version": "0.58.0",
      "revision": "ca298380a7971fc10c2b3e907e7802fdf3680262",
      "integrity": {
        "algorithm": "sha256",
        "packageSha256": "a080f3f3fdb60855830f674b25d1f651e99f4b6d22ad40baf27ffd0918ea8ce6"
      }
    },
    {
      "id": "provider-codegraph",
      "source": "https://github.com/chainabit/plugins.git#providers/provider-codegraph",
      "version": "1.5.0",
      "revision": "ca298380a7971fc10c2b3e907e7802fdf3680262",
      "integrity": {
        "algorithm": "sha256",
        "packageSha256": "a451c88fe8689f474208ba504003c1ad6850266b866861e33158f24e5faf19d4"
      }
    },
    {
      "id": "skill-software-engineering",
      "source": "https://github.com/chainabit/plugins.git#foundations/skill-software-engineering",
      "version": "1.0.0",
      "revision": "ca298380a7971fc10c2b3e907e7802fdf3680262",
      "integrity": {
        "algorithm": "sha256",
        "packageSha256": "9320bc5126d8942c73830a990af530196066d1ce89614f05e4965a1edad0f0fd"
      }
    },
    {
      "id": "skill-brand-defaults",
      "source": "https://github.com/chainabit/plugins.git#foundations/skill-brand-defaults",
      "version": "1.1.0",
      "revision": "ca298380a7971fc10c2b3e907e7802fdf3680262",
      "integrity": {
        "algorithm": "sha256",
        "packageSha256": "bbcebe14b925ed85466b28f7fc74d696325ebc9666b87636df217e4117fe2ac3"
      }
    },
    {
      "id": "skill-project-bootstrap",
      "source": "https://github.com/chainabit/plugins.git#foundations/skill-project-bootstrap",
      "version": "1.1.0",
      "revision": "ca298380a7971fc10c2b3e907e7802fdf3680262",
      "integrity": {
        "algorithm": "sha256",
        "packageSha256": "ef617bda0c0929860305c470a9de1ab5e2170f3325e90f596557073f833920fb"
      }
    },
    {
      "id": "skill-git",
      "source": "https://github.com/chainabit/plugins.git#foundations/skill-git",
      "version": "1.0.0",
      "revision": "ca298380a7971fc10c2b3e907e7802fdf3680262",
      "integrity": {
        "algorithm": "sha256",
        "packageSha256": "278a43afab6268a62c58616f597fdc82a13640d40de46e85e2f1680e41fcf1bf"
      }
    },
    {
      "id": "skill-project-documentation",
      "source": "https://github.com/chainabit/plugins.git#foundations/skill-project-documentation",
      "version": "1.0.0",
      "revision": "ca298380a7971fc10c2b3e907e7802fdf3680262",
      "integrity": {
        "algorithm": "sha256",
        "packageSha256": "9443270a3b9b1828ea81ab719404103c00e2d3e16f4e16710f74a9536ce9b59f"
      }
    },
    {
      "id": "skill-web-engineering",
      "source": "https://github.com/chainabit/plugins.git#web/skill-web-engineering",
      "version": "1.0.0",
      "revision": "ca298380a7971fc10c2b3e907e7802fdf3680262",
      "integrity": {
        "algorithm": "sha256",
        "packageSha256": "281a4392e338a990c6f2d4b46e5fc86dae218c9acf8a7af9af9f521944cf6163"
      }
    },
    {
      "id": "skill-static-website",
      "source": "https://github.com/chainabit/plugins.git#web/skill-static-website",
      "version": "1.3.6",
      "revision": "ca298380a7971fc10c2b3e907e7802fdf3680262",
      "integrity": {
        "algorithm": "sha256",
        "packageSha256": "8a84fcf16b50386c8bdad328ec1529c86f6519e3a295b6526276ba57a29c3585"
      }
    },
    {
      "id": "skill-react-page",
      "source": "https://github.com/chainabit/plugins.git#web/skill-react-page",
      "version": "1.1.1",
      "revision": "ca298380a7971fc10c2b3e907e7802fdf3680262",
      "integrity": {
        "algorithm": "sha256",
        "packageSha256": "e20623749c32900692228f5fc8e2cadeccb888d410f151ee10d9a934e8c5086a"
      }
    },
    {
      "id": "skill-angular",
      "source": "https://github.com/chainabit/plugins.git#web/skill-angular",
      "version": "1.1.0",
      "revision": "ca298380a7971fc10c2b3e907e7802fdf3680262",
      "integrity": {
        "algorithm": "sha256",
        "packageSha256": "3aac2d07d2d0039b64254c093c5df40eeb4c30be9648a3b5cec7fd010138a105"
      }
    },
    {
      "id": "skill-react",
      "source": "https://github.com/chainabit/plugins.git#web/skill-react",
      "version": "1.1.0",
      "revision": "ca298380a7971fc10c2b3e907e7802fdf3680262",
      "integrity": {
        "algorithm": "sha256",
        "packageSha256": "97a21c44705a1ccb347c8deafd9d8dc0a4cf05025be4bf24ea221472988a5737"
      }
    },
    {
      "id": "skill-python",
      "source": "https://github.com/chainabit/plugins.git#languages/skill-python",
      "version": "1.1.0",
      "revision": "ca298380a7971fc10c2b3e907e7802fdf3680262",
      "integrity": {
        "algorithm": "sha256",
        "packageSha256": "a50ee065ea59a4cfd38f356a959031e90c15cd3a6814bd6f502013281efbdd62"
      }
    },
    {
      "id": "skill-java",
      "source": "https://github.com/chainabit/plugins.git#languages/skill-java",
      "version": "1.0.0",
      "revision": "ca298380a7971fc10c2b3e907e7802fdf3680262",
      "integrity": {
        "algorithm": "sha256",
        "packageSha256": "d355802868a703e7172b86fba7ed7cf710fdc1266c0e96e0adea37d2cff3854d"
      }
    },
    {
      "id": "skill-django",
      "source": "https://github.com/chainabit/plugins.git#frameworks/skill-django",
      "version": "1.0.0",
      "revision": "ca298380a7971fc10c2b3e907e7802fdf3680262",
      "integrity": {
        "algorithm": "sha256",
        "packageSha256": "db7cca0b2f388090cdfa618880379b8b0ad7bcf8038c259fe4cf05d1fd157de8"
      }
    },
    {
      "id": "skill-spring",
      "source": "https://github.com/chainabit/plugins.git#frameworks/skill-spring",
      "version": "1.0.0",
      "revision": "ca298380a7971fc10c2b3e907e7802fdf3680262",
      "integrity": {
        "algorithm": "sha256",
        "packageSha256": "e0d54c25b48f14eb683eafa75150ca70606cf07318e284d218ea59eda194c053"
      }
    },
    {
      "id": "skill-rust",
      "source": "https://github.com/chainabit/plugins.git#languages/skill-rust",
      "version": "1.0.0",
      "revision": "ca298380a7971fc10c2b3e907e7802fdf3680262",
      "integrity": {
        "algorithm": "sha256",
        "packageSha256": "d38ddd4d9db8892395731b2c2d8bd2c851f7a13cfc3116c1fd14b220244d0bcd"
      }
    },
    {
      "id": "skill-go",
      "source": "https://github.com/chainabit/plugins.git#languages/skill-go",
      "version": "1.0.0",
      "revision": "ca298380a7971fc10c2b3e907e7802fdf3680262",
      "integrity": {
        "algorithm": "sha256",
        "packageSha256": "5fb3eb96de3a1c459907119fd30095fcaa2004859fa69182c54915ece9cceb5d"
      }
    },
    {
      "id": "skill-php",